{
  "schema_version": 1,
  "corpus_id": "synthetic-example-v1",
  "run_id": "synthetic-baseline-v1",
  "corpus_sha256": "c2c62d71da0d29b55f11882163558f6ee61d9ee1b4b69b0986dc46ec5f1c4c08",
  "run_sha256": "7279d6e854f0e4195e954a94d013ab66fdec20a6862665e6fe8c7ae5ef2c4f7f",
  "configuration": {
    "prompt_id": "prompt-baseline",
    "model_id": "synthetic-model",
    "model_version": "1",
    "quantization": "Q4_K_M"
  },
  "performance": {
    "latency_seconds": 12.5,
    "peak_rss_mb": 2048.0
  },
  "quality": {
    "status": "complete",
    "coverage_percent": 100.0,
    "timeout_chunks": 0,
    "invalid_output_chunks": 0,
    "truncated_outputs": 0
  },
  "confidence_threshold": 0.9,
  "totals": {
    "ground_truth_required": 2,
    "ground_truth_optional": 1,
    "ground_truth_must_not_warn": 1,
    "findings": 4,
    "scored_findings": 3,
    "true_positive": 1,
    "false_positive": 2,
    "false_negative": 1,
    "optional_accepted": 1,
    "explicit_negative_hits": 1,
    "precision": 0.3333333333333333,
    "recall": 0.5,
    "f1": 0.4
  },
  "by_category": {
    "date": {
      "ground_truth_required": 1,
      "ground_truth_optional": 0,
      "ground_truth_must_not_warn": 0,
      "findings": 0,
      "scored_findings": 0,
      "true_positive": 0,
      "false_positive": 0,
      "false_negative": 1,
      "optional_accepted": 0,
      "explicit_negative_hits": 0,
      "precision": 0.0,
      "recall": 0.0,
      "f1": 0.0
    },
    "proper_name": {
      "ground_truth_required": 0,
      "ground_truth_optional": 0,
      "ground_truth_must_not_warn": 1,
      "findings": 1,
      "scored_findings": 1,
      "true_positive": 0,
      "false_positive": 1,
      "false_negative": 0,
      "optional_accepted": 0,
      "explicit_negative_hits": 1,
      "precision": 0.0,
      "recall": 1.0,
      "f1": 0.0
    },
    "spelling": {
      "ground_truth_required": 1,
      "ground_truth_optional": 0,
      "ground_truth_must_not_warn": 0,
      "findings": 1,
      "scored_findings": 1,
      "true_positive": 1,
      "false_positive": 0,
      "false_negative": 0,
      "optional_accepted": 0,
      "explicit_negative_hits": 0,
      "precision": 1.0,
      "recall": 1.0,
      "f1": 1.0
    },
    "technical": {
      "ground_truth_required": 0,
      "ground_truth_optional": 0,
      "ground_truth_must_not_warn": 0,
      "findings": 1,
      "scored_findings": 1,
      "true_positive": 0,
      "false_positive": 1,
      "false_negative": 0,
      "optional_accepted": 0,
      "explicit_negative_hits": 0,
      "precision": 0.0,
      "recall": 1.0,
      "f1": 0.0
    },
    "word_choice": {
      "ground_truth_required": 0,
      "ground_truth_optional": 1,
      "ground_truth_must_not_warn": 0,
      "findings": 1,
      "scored_findings": 0,
      "true_positive": 0,
      "false_positive": 0,
      "false_negative": 0,
      "optional_accepted": 1,
      "explicit_negative_hits": 0,
      "precision": 1.0,
      "recall": 1.0,
      "f1": 1.0
    }
  },
  "by_confidence": {
    "certain": {
      "findings": 2,
      "scored_findings": 2,
      "true_positive": 1,
      "false_positive": 1,
      "optional_accepted": 0,
      "explicit_negative_hits": 1,
      "precision": 0.5
    },
    "uncertain": {
      "findings": 2,
      "scored_findings": 1,
      "true_positive": 0,
      "false_positive": 1,
      "optional_accepted": 1,
      "explicit_negative_hits": 0,
      "precision": 0.0
    }
  },
  "documents": [
    {
      "document_id": "synthetic-doc-01",
      "score": {
        "ground_truth_required": 2,
        "ground_truth_optional": 1,
        "ground_truth_must_not_warn": 1,
        "findings": 4,
        "scored_findings": 3,
        "true_positive": 1,
        "false_positive": 2,
        "false_negative": 1,
        "optional_accepted": 1,
        "explicit_negative_hits": 1,
        "precision": 0.3333333333333333,
        "recall": 0.5,
        "f1": 0.4
      }
    }
  ],
  "outcomes": [
    {
      "document_id": "synthetic-doc-01",
      "outcome": "tp",
      "reason": "accepted_required",
      "category": "spelling",
      "ground_truth_id": "E001",
      "finding_id": "F001"
    },
    {
      "document_id": "synthetic-doc-01",
      "outcome": "optional",
      "reason": "accepted_optional",
      "category": "word_choice",
      "ground_truth_id": "O001",
      "finding_id": "F002"
    },
    {
      "document_id": "synthetic-doc-01",
      "outcome": "fp",
      "reason": "explicit_negative",
      "category": "proper_name",
      "ground_truth_id": "N001",
      "finding_id": "F003"
    },
    {
      "document_id": "synthetic-doc-01",
      "outcome": "fp",
      "reason": "unmatched_prediction",
      "category": "technical",
      "ground_truth_id": null,
      "finding_id": "F004"
    },
    {
      "document_id": "synthetic-doc-01",
      "outcome": "fn",
      "reason": "missed_required",
      "category": "date",
      "ground_truth_id": "E002",
      "finding_id": null
    }
  ]
}
